Item,Descrição,Embalagem,TIPO
7826,ALMONDEGA DE CARNE ALVORADA CONG. - 450g,,RESFRIADO
2691,ASSADO DE SALSICHA ALVORADA UN - 100g,10,RESFRIADO
7746,BAGUETE LEVAIN GERGELIM UN - 200g,,RESFRIADO
7735,BAGUETE LEVAIN TRADICIONAL UN - 200g,,RESFRIADO
2583,BISCOITAO TRADICIONAL KG  - 1,2,RESFRIADO
1901,BOLINHA DE MILHO MINI KG  - 1,3,RESFRIADO
8805,BOLINHA DE PIZZA MINI BDJ CONG - 300g,,RESFRIADO
1885,BOLINHA DE PIZZA MINI KG - 1,3,RESFRIADO
5336,BOLINHA DE QUEIJO ALVORADA CONG - 1kg,,RESFRIADO
1903,BOLINHA DE QUEIJO KG - 1,3,RESFRIADO
2135,BOLINHO DE BACALHAU KG - 1,3,RESFRIADO
9753,BOLINHO DE QUEIJO MINI BDJ CONG - 300g,,RESFRIADO
4729,BOLO CONFEITADO AVELA UN - 900g,,RESFRIADO
9955,BOLO CONFEITADO DOCE DE LEITE UN - 900g,,RESFRIADO
7223,BOLO CONFEITADO FLOCOS UN - 900g,,RESFRIADO
2840,BOLO CONFEITADO MARACUJÁ UN - 900g,,RESFRIADO
2519,BOLO CONFEITADO PISTACHE UN  - 900g,,RESFRIADO
2533,BOLO GOURMET CHOCOLATE C/CREME AVELA - 600g,,RESFRIADO
3988,BOLO GOURMET LETINHO C/NOZES ALVORADA UN - 600g,,RESFRIADO
4973,BOLO PREMIUM 4 LEITES UN - 800g,,RESFRIADO
5579,BOLO PREMIUM CHOCOLATE UN - 800g,,RESFRIADO
3522,BOLO PREMIUM COCO UN  - 800g,,RESFRIADO
9828,BOLO PREMIUM NOZES UN - 800g,,RESFRIADO
4380,BROA AEROSA KG - 1,10,RESFRIADO
8807,CALDO DE ERVILHA UN - 500g,,RESFRIADO
8380,CALDO DE FEIJAO UN - 500g,,RESFRIADO
5912,CALDO DE MILHO UN - 500g,,RESFRIADO
8382,CALDO VERDE UN - 500g,,RESFRIADO
4379,CHURROS DOCE DE LEITE KG - 1,10,RESFRIADO
4562,CIGARRETE UN CD - 130g,20,RESFRIADO
2825,COXA E SOBRECOXA C/PURE ALVORADA - 600g,,RESFRIADO
2542,COXINHA DE FRANGO C/REQUEIJAO GRANDE UN  - 100g,15,RESFRIADO
1902,COXINHA DE FRANGO GRANDE UN - 100g,15,RESFRIADO
5337,COXINHA DE FRANGO MINI ALVORADA CONG 1KG - 1kg,,RESFRIADO
1904,COXINHA DE FRANGO MINI KG - 1,3,RESFRIADO
2917,CROISSANT ALVORADA UN - 60g,8,RESFRIADO
2383,CROISSANT DE FRANGO UN - 100g,8,RESFRIADO
2900,CROISSANT PRESUNTO E QUEIJO ALVORADA UN - 120g,8,RESFRIADO
2515,DOGUINHO C.D. ALVORADA KG - 1,15,RESFRIADO
2394,EMPADA DE CARNE SECA UN - 100g,15,RESFRIADO
1886,EMPADA DE FRANGO UN - 100g,15,RESFRIADO
2393,EMPADA DE PALMITO UN  - 100g,15,RESFRIADO
2838,ESCONDIDINHO DE CARNE ALVORADA CONG 600G - 600g,,RESFRIADO
2839,ESCONDIDINHO DE FRANGO ALVORADA CONG. - 600g,,RESFRIADO
4819,ESFIHA ABERTA 4 QUEIJOS UN - 200g,15,RESFRIADO
4818,ESFIHA ABERTA DE CARNE UN - 200g,15,RESFRIADO
2629,ESFIHA ABERTA DE FRANGO C/REQUEIJAO UN - 200g,15,RESFRIADO
2599,ESFIHA FECHADA DE CARNE UN - 100g,10,RESFRIADO
2624,ESFIHA FECHADA DE FRANGO C/REQUEIJAO UN - 100g,10,RESFRIADO
2554,FEIJAO TROPEIRO ALVORADA CONGELADO UN - 450g,,RESFRIADO
8435,FEIJOADA ALVORADA UN  - 700g,,RESFRIADO
7695,FRICASSE DE FRANGO ALVORADA CONG. 600G - 600g,,RESFRIADO
1933,GELO EM CUBOS / TRITURADO ALVORADA 3 KG - 3kg,,RESFRIADO
2379,"GELO EM CUBOS /TRITURADO ALVORADA 1,5 KG - 1,5kg",,RESFRIADO
8966,KIT PETISCO (COXINHA+BOLINHO QUEIJO) BDJ - 300g,,RESFRIADO
7506,LASANHA BOLONHESA ALVORADA CONG. - 600g,,RESFRIADO
7510,LASANHA FRANGO ALVORADA CONG. 600G  - 600g,,RESFRIADO
7513,LASANHA QUATRO QUEIJO ALVORADA CONG - 600g,,RESFRIADO
7776,MEDALHAO DE FRANGO ALVORADA CONG. - 300g,,RESFRIADO
5352,MINI EMPADA DE FRANGO ALVORADA C/6 UN - 280g,,RESFRIADO
2198,MINI EMPADINHA ALVORADA KG - 1,15,RESFRIADO
5369,MISTO PRESUNTO E QUEIJO UN - 200g,10,RESFRIADO
2833,PALITINHO DE TAPIOCA ALVORADA KG - 1,,RESFRIADO
5372,PAO DE LO BAUNILHA UN (PRODUÇÃO) - 300g,,RESFRIADO
5371,PAO DE LO CHOCOLATE UN (PRODUÇÃO) - 300g,,RESFRIADO
1873,PAO DE QUEIJO 3 QUEIJOS ALVORADA KG - 1,10,RESFRIADO
1966,PAO DE QUEIJO 3 QUEIJOS C. ALVORADA 400G - 400g,,RESFRIADO
2248,PAO DE QUEIJO COQUETEL ALVORADA CONG400G - 400g,,RESFRIADO
1967,PAO DE QUEIJO LANCHE ALVORADA  CONG 1KG - 1kg,,RESFRIADO
1868,PAO DE QUEIJO LANCHE ALVORADA KG - 1,10,RESFRIADO
2570,PAO DE QUEIJO RECH. C/FRANGO ALVORADA KG - 1,10,RESFRIADO
1978,PAO DE QUEIJO TRAD ALVORADA CONG 1KG  - 1kg,,RESFRIADO
1959,PAO DE QUEIJO TRAD. ALVORADA CONG 400G - 400g,,RESFRIADO
1864,PAO DE QUEIJO TRADICIONAL ALVORADA KG - 1,10,RESFRIADO
1936,PAO LEVAIN CACAU C/ LARANJA UN  - 200g,,RESFRIADO
3969,PÃO LEVAIN CAMPANHA UN - 200g,,RESFRIADO
2532,PAO LEVAIN CIABATTA C/2 CONG. ALVORADA - 200g,,RESFRIADO
3970,PAO LEVAIN CUPIAC UN - 200g,,RESFRIADO
2535,PAO LEVAIN FOCACCIA CONG.UN - 200g,,RESFRIADO
2499,PAO LEVAIN ITALIANO BOLA C/2 CONG.UN - 200g,,RESFRIADO
2581,PAO LEVAIN MINI BAGUETE C/2UN CONG - 200g,,RESFRIADO
2836,PAPPARDELLE C/ALMONDEGA ALVORADA CONG. - 600g,,RESFRIADO
1920,PARMEGIANA DE FRANGO CONG. ALVORADA  - 400g,,RESFRIADO
2678,PASTEL ASSADO DE FRANGO UN - 1un,10,RESFRIADO
267250,PASTEL DE FARINHA DE MILHO CARNE 100g - 100g,10,RESFRIADO
267251,PASTEL DE FARINHA DE MILHO QUEIJO 100g - 100g,10,RESFRIADO
8406,PASTEL DE MILHO CARNE KG - 1,5,RESFRIADO
8408,PASTEL DE MILHO PIZZA KG - 1,5,RESFRIADO
8407,PASTEL DE MILHO QUEIJO KG - 1,5,RESFRIADO
9371,PASTEL DE NATA UN - 75g,48,RESFRIADO
7636,PIZZA CALABRESA ALVORADA CONG.500G - 500g,,RESFRIADO
7645,PIZZA DA CASA ALVORADA CONG 500G - 500g,,RESFRIADO
7637,PIZZA FRANGO C/REQUEIJAO ALVO CONG 500G - 500g,,RESFRIADO
7639,PIZZA PRESUNTO E QUEIJO CONG. ALVORADA - 500g,,RESFRIADO
1923,QUIBE DE CARNE C/ REQUEIJAO MINI  KG - 1,3,RESFRIADO
2496,QUIBE DE CARNE GRANDE UN - 100g,25,RESFRIADO
1875,QUIBE DE CARNE MINI  KG - 1,3,RESFRIADO
5338,QUIBE DE CARNE MINI ALVORADA CONG - 1KG - 1kg,,RESFRIADO
8803,QUIBE DE CARNE MINI BDJ CONG - 300g,,RESFRIADO
7822,STROGONOFF DE CARNE ALVORADA CONG. - 600g,,RESFRIADO
7926,STROGONOFF DE CARNE E ARROZ CONG. 450G - 450g,,RESFRIADO
7824,STROGONOFF DE FRANGO ALVORADA CONG. 600G - 600g,,RESFRIADO
7927,STROGONOFF DE FRANGO E ARROZ CONG. 450G - 450g,,RESFRIADO
5291,TORTA DE FRANGO C/CATUPIRY KG - 1,,RESFRIADO
2911,TORTA GOURMET BUENO ALVORADA UN - 450g,,RESFRIADO
2909,TORTA GOURMET DE CREME MORANGO UN - 500g,,RESFRIADO
2919,TORTA GOURMET LEITINHO C/COOKIES - 500g,,RESFRIADO
5597,TORTA GOURMET LIMÃO UN  - 450g,,RESFRIADO
2544,TORTA HOLANDESA ALVORADA UN - 400g,,RESFRIADO
9988,BISC. AMANTEIGADO BEIJINHO DE COCO UN - 200g,,PRODUTO
9960,BISC. AMANTEIGADO BEIJINHO DE FREIRA UN - 200g,,PRODUTO
267039,BISC. AMANTEIGADO BELISCAO UN  - 200g,,PRODUTO
267141,BISC. AMANTEIGADO BELISCAO UN - 200g,,PRODUTO
9959,BISC. AMANTEIGADO BRANCA DE NEVE UN - 200g,,PRODUTO
267040,BISC. AMANTEIGADO BRIGADEIRO UN - 200g,,PRODUTO
267041,BISC. AMANTEIGADO CHOCOFESTA UN - 200g,,PRODUTO
267070,BISC. AMANTEIGADO CORAÇAO DE LEITE NINHO - 200g,,PRODUTO
1994,BISC. AMANTEIGADO DIVERSOS UN - 200g,,PRODUTO
267042,BISC. AMANTEIGADO FEITIÇO UN - 200g,,PRODUTO
267043,BISC. AMANTEIGADO JUJU UN - 200g,,PRODUTO
267045,BISC. AMANTEIGADO MORENINHA UN - 200g,,PRODUTO
267044,BISC. AMANTEIGADO NEGRESCO UN - 200g,,PRODUTO
267046,BISC. AMANTEIGADO OURO BRANCO UN - 200g,,PRODUTO
267048,BISC. AMANTEIGADO PALITO CHOC. BRANCO UN - 200g,,PRODUTO
267047,BISC. AMANTEIGADO PALITO DE CHOCOLATE UN - 200g,,PRODUTO
267049,BISC. AMANTEIGADO PAO DE MEL UN - 200g,,PRODUTO
267050,BISC. AMANTEIGADO PRESTIGIO UN - 200g,,PRODUTO
267051,BISC. AMANTEIGADO PRESTOCOCO UN - 200g,,PRODUTO
267052,BISC. AMANTEIGADO ROSCA DE COCO UN - 200g,,PRODUTO
267053,BISC. AMANTEIGADO ROSCA DE FLOCOS UN - 200g,,PRODUTO
267054,BISC. AMANTEIGADO ROSCA DE NATA UN - 200g,,PRODUTO
267055,BISC. AMANTEIGADO SEQUILHO LEITE COND UN - 200g,,PRODUTO
5365,BISCOITO DE POLVILHO ARGOLA UN  - 200g,,PRODUTO
2843,BISCOITO DE POLVILHO BOLINHA QUEIJO KG - 1,,PRODUTO
5366,BISCOITO DE POLVILHO BOLINHA QUEIJO UN - 200g,,PRODUTO
5360,BISCOITO DE POLVILHO KG - 1,,PRODUTO
5367,BISCOITO DE POLVILHO PALITO UN - 200g,,PRODUTO
2695,MASSA P/PIZZA ALVORADA C/2UN - 480g,,PRODUTO
5826,BOLO CASEIRO LARANJA UN - 250g,,PRODUTO
6361,BOLO CASEIRO TANGERINA CD - 250g,,PRODUTO
2490,BOLO CREMOSO ABACAXI UN - 300g,,PRODUTO
2498,BOLO CREMOSO ABOBORA C/COCO UN - 300g,,PRODUTO
2176,BOLO CREMOSO AIPIM UN - 300g,,PRODUTO
2488,BOLO CREMOSO BANANA C/GRANOLA UN - 300g,,PRODUTO
2177,BOLO CREMOSO CACAROLA UN - 300g,,PRODUTO
2486,BOLO CREMOSO CENOURA UN - 300g,,PRODUTO
2192,BOLO CREMOSO CHOCOLATE UN - 300g,,PRODUTO
2184,BOLO CREMOSO CHURROS UN  - 300g,,PRODUTO
2187,BOLO CREMOSO COCO UN - 300g,,PRODUTO
2188,BOLO CREMOSO FRUTAS VERMELHAS UN - 270g,,PRODUTO
2189,BOLO CREMOSO LARANJA UN - 300g,,PRODUTO
7942,BOLO CREMOSO LEITE CONDENSADO UN - 300g,,PRODUTO
2107,BOLO CREMOSO MARACUJA UN - 300g,,PRODUTO
2190,BOLO CREMOSO MILHO UN - 300g,,PRODUTO
2247,BOLO CREMOSO RED VELVET C/COBERTURA UN - 270g,,PRODUTO
2786,BOLO DE ABACAXI UN - 300g,,PRODUTO
2749,BOLO DE BANANA UN - 350g,,PRODUTO
2806,BOLO DE CENOURA C/COBERTURA UN - 180g,,PRODUTO
2696,BOLO DE CENOURA UN - 300g,,PRODUTO
2808,BOLO DE CHOCOLATE C/COBERTURA UN - 180g,,PRODUTO
2699,BOLO DE CHOCOLATE UN - 300g,,PRODUTO
2807,BOLO DE COCO C/COBERTURA UN - 180g,,PRODUTO
2792,BOLO DE COCO UN - 300g,,PRODUTO
2805,BOLO DE FUBA UN - 300g,,PRODUTO
2789,BOLO DE LARANJA UN - 300g,,PRODUTO
2813,BOLO DE LEITE CONDENSADO UN - 300g,,PRODUTO
2809,BOLO DE LIMAO C/COBERTURA UN - 180g,,PRODUTO
2779,BOLO DE LIMAO UN - 300g,,PRODUTO
2791,BOLO DE MILHO UN - 300g,,PRODUTO
2755,BOLO FORMIGUEIRO UN - 300g,,PRODUTO
2484,BOLO INGLES CHOCOLATE UN 200G - 200g,,PRODUTO
8120,BOLO INGLES FORMIGUEIRO UN 200G - 200g,,PRODUTO
6517,BOLO INGLES LARANJA UN 200G  - 200g,,PRODUTO
8855,BOLO INGLES MESCLADO UN  200G - 200g,,PRODUTO
4438,BOLO INGLES MILHO UN 200G - 200g,,PRODUTO
2915,BOLO NEUTRO UN - 300g,,PRODUTO
4127,BOLO REDONDO ABACAXI UN - 280g,,PRODUTO
4531,BOLO REDONDO CENOURA C/COBERTURA - 350g,,PRODUTO
4130,BOLO REDONDO CENOURA UN - 280g,,PRODUTO
4498,BOLO REDONDO CHOCOLATE C/COBERTURA - 350g,,PRODUTO
4043,BOLO REDONDO CHOCOLATE UN - 280g,,PRODUTO
5068,BOLO REDONDO CHURROS C/ COBERTURA - 1,,PRODUTO
2102,BOLO REDONDO CHURROS C/COBERTURA UN - 300g,,PRODUTO
4533,BOLO REDONDO COCO C/COBERTURA - 350g,,PRODUTO
4045,BOLO REDONDO COCO UN - 280g,,PRODUTO
4044,BOLO REDONDO FORMIGUEIRO UN - 280g,,PRODUTO
4186,BOLO REDONDO FUBA UN - 280g,,PRODUTO
4047,BOLO REDONDO LARANJA UN - 280g,,PRODUTO
4131,BOLO REDONDO LEITE CONDENSADO UN - 280g,,PRODUTO
2089,BOLO REDONDO LIMAO C/COBERTURA UN - 300g,,PRODUTO
4137,BOLO REDONDO LIMAO UN - 280g,,PRODUTO
4160,BOLO REDONDO MILHO UN - 280g,,PRODUTO
4168,BOLO REDONDO NEUTRO UN - 280g,,PRODUTO
2910,BROWNIE DE CHOCOLATE C/COBERTURA UN - 180g,,PRODUTO
2938,BROWNIE DE CHOCOLATE TRADICIONAL UN - 180g,,PRODUTO
8176,COELHO RECHEADO DE BRIGADEIRO UN - 300g,,PRODUTO
8282,COOKIES C/CREME DE AVELA UN 240G - 240g,,PRODUTO
2577,COOKIES CHOCOLATE ALVORADA UN  - 170g,,PRODUTO
2578,COOKIES TRADICIONAL ALVORADA UN  - 170g,,PRODUTO
9355,DONUTS SABORES UN - 90g,,PRODUTO
2596,ANTEPASTO ALVORADA UN - 400g,,CONFEITARIA
2908,BOLO ARTESANAL BRIGADEIRO UN  - 250g,,CONFEITARIA
2116,BOLO CONF. SABORES  900 gr - 900g,,PRODUTO
8478,BOLO GELADO DE COCO UN  - 120g,,CONFEITARIA
4817,BOLO INDIANO UN - 250g,,CONFEITARIA
266328,BOLO PREMIUM NOZES - 1un,,PRODUTO
7818,BRIGADEIRAO ALVORADA UN - 350g,,CONFEITARIA
3928,CACAROLA ITALIANA UN - 300g,,CONFEITARIA
1165,CAKE DE CENOURA TRUFADO C/AVELA ALVORADA - 250g,,CONFEITARIA
2552,CAKE PAO DE MEL ALVORADA UN - 250g,,CONFEITARIA
3924,CREME HOLANDES UN - 150g,,CONFEITARIA
2888,MANJAR DE COCO UN 150g - 150g,,CONFEITARIA
2804,MANJAR DE COCO UN 600g - 600g,,CONFEITARIA
1666,MOUSSE DE CHOCOLATE  ALVORADA KG - 1,,CONFEITARIA
3920,MOUSSE DE CHOCOLATE UN 150g - 150g,,CONFEITARIA
2526,MOUSSE DE CHOCOLATE UN 600g - 600g,,CONFEITARIA
3919,MOUSSE DE MARACUJA UN 200g - 200g,,CONFEITARIA
2389,MOUSSE DE MARACUJA UN 600g - 600g,,CONFEITARIA
8817,OVO DE PASCOA MORANGO 250g - 250g,,PRODUTO
8177,OVO DE PASCOA NEGRESCO 250g - 250g,,PRODUTO
2853,PALHA ITALIANA UN - 250g,,PRODUTO
1342,PAO DE ALHO ALVORADA - 300g,,PRODUTO
2896,PUDIM GRANDE UN 750G - 750g,,CONFEITARIA
2877,PUDIM PEQUENO UN - 95g,,CONFEITARIA
2879,QUINDIM UN - 100g,,CONFEITARIA
1032,ROCAMBOLE  KG - 1,,CONFEITARIA
7946,ROCAMBOLE DE PRESTIGIO FATIADO UN - 350g,,CONFEITARIA
7945,ROCAMBOLE DE PRESTIGIO UN - 350g,,CONFEITARIA
4402,ROCAMBOLE DOCE DE LEITE FATIADO UN - 350g,,CONFEITARIA
2902,ROCAMBOLE DOCE DE LEITE UN - 350g,,CONFEITARIA
2903,ROCAMBOLE GOIABADA CD UN - 500g,,CONFEITARIA
7224,TRONQUINHO CASEIRO CHOCOLATE KG - 1,,PRODUTO
4729,BOLO CONFEITADO AVELA UN - 900g,,PRODUTO
9955,BOLO CONFEITADO DOCE DE LEITE UN - 900g,,PRODUTO
7223,BOLO CONFEITADO FLOCOS UN - 900g,,PRODUTO
2840,BOLO CONFEITADO MARACUJÁ UN - 900g,,PRODUTO
2519,BOLO CONFEITADO PISTACHE UN  - 900g,,PRODUTO
2533,BOLO GOURMET CHOCOLATE C/CREME AVELA - 600g,,PRODUTO
3988,BOLO GOURMET LETINHO C/NOZES ALVORADA UN - 600g,,PRODUTO
4973,BOLO PREMIUM 4 LEITES UN - 800g,,PRODUTO
5579,BOLO PREMIUM CHOCOLATE UN - 800g,,PRODUTO
3522,BOLO PREMIUM COCO UN  - 800g,,PRODUTO
9828,BOLO PREMIUM NOZES UN - 800g,,PRODUTO
4379,CHURROS DOCE DE LEITE KG - 1,,PRODUTO
9371,PASTEL DE NATA UN - 75g,,PRODUTO
2564,TORTA GOURMET ALVORADA SABORES KG - 1,,PRODUTO
2911,TORTA GOURMET BUENO ALVORADA UN - 450g,,PRODUTO
2909,TORTA GOURMET DE CREME MORANGO UN - 500g,,PRODUTO
2919,TORTA GOURMET LEITINHO C/COOKIES - 500g,,PRODUTO
5597,TORTA GOURMET LIMÃO UN  - 450g,,PRODUTO
2544,TORTA HOLANDESA ALVORADA UN - 400g,,PRODUTO
7826,ALMONDEGA DE CARNE ALVORADA CONG. - 450g,,PRODUTO
8807,CALDO DE ERVILHA UN - 500g,,PRODUTO
8380,CALDO DE FEIJAO UN - 500g,,PRODUTO
5912,CALDO DE MILHO UN - 500g,,PRODUTO
8382,CALDO VERDE UN - 500g,,PRODUTO
259138,COSTELINHA BARBECUE ALVORADA CONG UN - 450g,,PRODUTO
2825,COXA E SOBRECOXA C/PURE ALVORADA - 600g,,PRODUTO
2838,ESCONDIDINHO DE CARNE ALVORADA CONG 600G - 600g,,PRODUTO
2839,ESCONDIDINHO DE FRANGO ALVORADA CONG. - 600g,,PRODUTO
2554,FEIJAO TROPEIRO ALVORADA CONGELADO UN - 450g,,PRODUTO
8435,FEIJOADA ALVORADA UN  - 700g,,PRODUTO
7695,FRICASSE DE FRANGO ALVORADA CONG. 600G - 600g,,PRODUTO
7506,LASANHA BOLONHESA ALVORADA CONG. - 600g,,PRODUTO
7510,LASANHA FRANGO ALVORADA CONG. 600G  - 600g,,PRODUTO
7513,LASANHA QUATRO QUEIJO ALVORADA CONG - 600g,,PRODUTO
259139,LOMBO ASSADO ALVORADA CONG. UN - 450g,,PRODUTO
7776,MEDALHAO DE FRANGO ALVORADA CONG. - 300g,,PRODUTO
2836,PAPPARDELLE C/ALMONDEGA ALVORADA CONG. - 600g,,PRODUTO
1920,PARMEGIANA DE FRANGO CONG. ALVORADA  - 400g,,PRODUTO
259140,PERNIL ASSADO ALVORADA CONG UN - 450g,,PRODUTO
7636,PIZZA CALABRESA ALVORADA CONG.500G - 500g,,PRODUTO
7645,PIZZA DA CASA ALVORADA CONG 500G - 500g,,PRODUTO
7637,PIZZA FRANGO C/REQUEIJAO ALVO CONG 500G - 500g,,PRODUTO
7639,PIZZA PRESUNTO E QUEIJO CONG. ALVORADA - 500g,,PRODUTO
7822,STROGONOFF DE CARNE ALVORADA CONG. - 600g,,PRODUTO
7926,STROGONOFF DE CARNE E ARROZ CONG. 450G - 450g,,PRODUTO
7824,STROGONOFF DE FRANGO ALVORADA CONG. 600G - 600g,,PRODUTO
7927,STROGONOFF DE FRANGO E ARROZ CONG. 450G - 450g,,PRODUTO
1933,GELO EM CUBOS / TRITURADO ALVORADA 3 KG - 3kg,,PRODUTO
2379,"GELO EM CUBOS /TRITURADO ALVORADA 1,5 KG - 1,5kg",,PRODUTO
66394,GELO EM CUBOS AKY - 3kg,,PRODUTO
220610,GELO EM CUBOS AKY 3KG - 3kg,,PRODUTO
4535,COLOMBA PASCAL C/FRUTAS CRISTALIZADAS UN - 550g,,PRODUTO
4534,COLOMBA PASCAL C/GOTAS DE CHOCOLATE UN  - 550g,,PRODUTO
2449,PANETTONE ALVORADA 100G   - 100g,,PRODUTO
2119,PANETTONE ALVORADA 900G UN - 900g,,PRODUTO
2253,PANETTONE ALVORADA CX - 400g,,PRODUTO
7098,PANETTONE ALVORADA UN 400G - 400g,,PRODUTO
2454,PANETTONE C/GOTAS DE CHOC. ALVORADA 80G - 80g,,PRODUTO
2286,PANETTONE C/GOTAS DE CHOC. ALVORADA CX - 400g,,PRODUTO
8134,PANETTONE C/GOTAS DE CHOC. ALVORADA UN - 400g,,PRODUTO
1942,ROSCATTONE GOTAS DE CHOCOLATE UN - 350g,,PRODUTO
8156,TRUFADO DE CREME BUENO - 600g,,PRODUTO
8152,TRUFADO DE CREME DE AVELA - 600g,,PRODUTO
2580,BISCOITAO C/QUEIJO KG - 1,,PRODUTO
2571,BISCOITAO DA ROCA KG - 1,,PRODUTO
2583,BISCOITAO TRADICIONAL KG  - 1,,PRODUTO
1901,BOLINHA DE MILHO MINI KG  - 1,,PRODUTO
8805,BOLINHA DE PIZZA MINI BDJ CONG - 300g,,PRODUTO
1885,BOLINHA DE PIZZA MINI KG - 1,,PRODUTO
5336,BOLINHA DE QUEIJO ALVORADA CONG - 1kg,,PRODUTO
1903,BOLINHA DE QUEIJO KG - 1,,PRODUTO
8121,BOLINHO DE BACALHAU BANDEJA ALVORADA UND - 400g,,PRODUTO
2135,BOLINHO DE BACALHAU KG - 1,,PRODUTO
9753,BOLINHO DE QUEIJO MINI BDJ CONG - 300g,,PRODUTO
4380,BROA AEROSA KG - 1,,PRODUTO
5337,COXINHA DE FRANGO MINI ALVORADA CONG 1KG - 1kg,,PRODUTO
7202,COXINHA DE FRANGO MINI BDJ CONG - 300g,,PRODUTO
1904,COXINHA DE FRANGO MINI KG - 1,,PRODUTO
8966,KIT PETISCO (COXINHA+BOLINHO QUEIJO) BDJ - 300g,,PRODUTO
8808,KIT PETISCO(QUIBE+BOLINHA PIZZA)BDJ CONG - 300g,,PRODUTO
4378,MINI BISCOITO DE QUEIJO KG  - 1,,PRODUTO
5695,MINI SALGADINHO ASSADO/FRITO ALVORADA KG - 1,,PRODUTO
2833,PALITINHO DE TAPIOCA ALVORADA KG - 1,,PRODUTO
1873,PAO DE QUEIJO 3 QUEIJOS ALVORADA KG - 1,,PRODUTO
1966,PAO DE QUEIJO 3 QUEIJOS C. ALVORADA 400G - 400g,,PRODUTO
2572,PAO DE QUEIJO C/FRANGO BANDEJA UN - 570g,,PRODUTO
2248,PAO DE QUEIJO COQUETEL ALVORADA CONG400G - 400g,,PRODUTO
1967,PAO DE QUEIJO LANCHE ALVORADA  CONG 1KG - 1kg,,PRODUTO
1868,PAO DE QUEIJO LANCHE ALVORADA KG - 1,,PRODUTO
2570,PAO DE QUEIJO RECH. C/FRANGO ALVORADA KG - 1,,PRODUTO
1978,PAO DE QUEIJO TRAD ALVORADA CONG 1KG  - 1kg,,PRODUTO
1959,PAO DE QUEIJO TRAD. ALVORADA CONG 400G - 400g,,PRODUTO
569,PAO DE QUEIJO TRADICIONAL ALVORADA KG  - 1,,PRODUTO
1864,PAO DE QUEIJO TRADICIONAL ALVORADA KG - 1,,PRODUTO
2227,PELE DE PORCO KG - 1,,PRODUTO
1923,QUIBE DE CARNE C/ REQUEIJAO MINI  KG - 1,,PRODUTO
1875,QUIBE DE CARNE MINI  KG - 1,,PRODUTO
5338,QUIBE DE CARNE MINI ALVORADA CONG - 1KG - 1kg,,PRODUTO
8803,QUIBE DE CARNE MINI BDJ CONG - 300g,,PRODUTO
2939,MASSA P/ PIZZA (MONTAGEM) UN - 260g,,PRODUTO
1922,MASSA P/ PIZZA 30CM (LOJA) - 260g,,PRODUTO
7943,PIZZA ASSADA ALVORADA SABORES KG - 1,,PRODUTO
2511,PIZZA ATUM PREMIUM 800G - 800g,,PRODUTO
2491,PIZZA CALABRESA ALVORADA - 800g,,PRODUTO
4169,PIZZA CALABRESA ALVORADA-460G  - 500g,,CONFEITARIA
2862,PIZZA CALABRESA GOURMET UN 720G - 720g,,CONFEITARIA
4171,PIZZA DA CASA ALVORADA 460G - 500g,,CONFEITARIA
2922,PIZZA DA CASA GOURMET UN 720G - 720g,,CONFEITARIA
4174,PIZZA FRANGO C/REQUEIJAO ALVORADA 460G  - 500g,,CONFEITARIA
2856,PIZZA FRANGO C/REQUEIJAO GOURMET UN - 720g,,CONFEITARIA
4543,PIZZA LOMBO ALVORADA UN 460G - 500g,,CONFEITARIA
4558,PIZZA LOMBO GOURMET UN 750G - 750g,,CONFEITARIA
4536,PIZZA MARGUERITA ALVORADA 500G - 500g,,PRODUTO
4554,PIZZA MARGUERITA GOURMET UN 750G - 750g,,PRODUTO
4573,PIZZA MISTA ALVORADA UN 460G - 500g,,CONFEITARIA
4553,PIZZA MISTA GOURMET UN 750G - 750g,,CONFEITARIA
2503,PIZZA NAPOLITANA ALVORADA - 800g,,PRODUTO
4175,PIZZA PORTUGUESA ALVORADA - 500g,,PRODUTO
2921,PIZZA PORTUGUESA GOURMET UN 720G - 720g,,PRODUTO
4176,PIZZA PRESUNTO E QUEIJO ALVORADA 460G  - 500g,,CONFEITARIA
2860,PIZZA PRESUNTO E QUEIJO GOURMET UN 750G - 750g,,CONFEITARIA
4177,PIZZA QUATRO QUEIJOS ALVORADA 460G - 500g,,CONFEITARIA
2857,PIZZA QUATRO QUEIJOS GOURMET UN 720G - 720g,,CONFEITARIA
2172,BRIOCHE C/COCO UN - 275g,,PRODUTO
2495,BRIOCHE TRADICIONAL UN - 225g,,PRODUTO
8470,BROA CASTANHA DE CAJU KG - 1,,PRODUTO
255563,PAO BRIOCHE ALVORADA UN - 400g,,PRODUTO
2175,PAO DE BATATA ALVORADA C/4UN  - 200g,,PRODUTO
5363,PAO DE CEBOLA ALVORADA UN - 200g,,PRODUTO
2555,PAO DE FORMA 52% INTEGRAL UN - 400g,,PRODUTO
5370,PAO DE FORMA P/TORTA UN - 400g,,PRODUTO
2916,PAO DE FORMA TRADICIONAL UN - 500g,,PRODUTO
2854,PAO DE FUBA KG - 1,,PRODUTO
2250,PAO DE HAMBURGUER C/GERGELIM C/4UN - 260g,,PRODUTO
2252,PAO DE HAMBURGUER TRADICIONAL C/4UN - 260g,,PRODUTO
2598,PAO DE HOT DOG C/4UN - 270g,,PRODUTO
2558,PAO DE MILHO TRADICIONAL C/4UN - 260g,,PRODUTO
2173,PAO SOVADO ALVORADA UN  - 475g,,PRODUTO
2906,PAULISTINHA CD C/5 UN - 200g,,PRODUTO
3932,ROSCA DA FAZENDA C/ACUCAR UN - 300g,,PRODUTO
2391,ROSCA DA FAZENDA UN 300G - 300g,,PRODUTO
2494,ROSCA DE LEITE CONDENSADO CD C/3 UN - 180g,,PRODUTO
2824,ROSCA LISA C/4 UN - 200g,,PRODUTO
2174,ROSCA RAINHA ALVORADA UN - 300g,,PRODUTO
4350,ROSCA RAINHA C/CREME UN - 300g,,PRODUTO
4491,ROSQUINHA C/ACUCAR C/4UN - 250g,,PRODUTO
4467,ROSQUINHA C/CREME C/4UN - 300g,,PRODUTO
5378,BAGUETE ITALIANA UN - 350g,,PRODUTO
7733,BAGUETE LEVAIN CALABRESA KG - 1,,PRODUTO
2004,BAGUETE LEVAIN CALABRESA UN - 200g,,PRODUTO
7746,BAGUETE LEVAIN GERGELIM UN - 200g,,PRODUTO
7735,BAGUETE LEVAIN TRADICIONAL UN - 200g,,PRODUTO
3976,CIABATTA C/AZEITONA KG - 1,,PRODUTO
2032,CIABATTA C/AZEITONA UN - 200g,,PRODUTO
3968,CIABATTA C/CALABRESA UN - 200g,,PRODUTO
3966,CIABATTA C/TOMATE SECO KG - 1,,PRODUTO
2034,CIABATTA C/TOMATE SECO UN - 200g,,PRODUTO
2917,CROISSANT ALVORADA UN - 60g,,PRODUTO
2383,CROISSANT DE FRANGO UN - 100g,,PRODUTO
2900,CROISSANT PRESUNTO E QUEIJO ALVORADA UN - 120g,,PRODUTO
3531,PAO DE GRAOS LEVAIN UN CD - 200g,,PRODUTO
4730,PAO FRANCES INTEGRAL ALVORADA KG - 1,,PRODUTO
6980,PAO ITALIANO LEVAIN UN CD - 200g,,PRODUTO
1936,PAO LEVAIN CACAU C/ LARANJA UN  - 200g,,PRODUTO
2532,PAO LEVAIN CIABATTA C/2 CONG. ALVORADA - 200g,,PRODUTO
3970,PAO LEVAIN CUPIAC UN - 200g,,PRODUTO
2061,PAO LEVAIN FOCACCIA CONG. KG - 1,,PRODUTO
2535,PAO LEVAIN FOCACCIA CONG.UN - 200g,,PRODUTO
2499,PAO LEVAIN ITALIANO BOLA C/2 CONG.UN - 200g,,PRODUTO
3980,PAO LEVAIN ITALIANO KG - 1,,PRODUTO
2059,PAO LEVAIN ITALIANO UN - 200g,,PRODUTO
3977,PAO LEVAIN MINEIROCA KG - 1,,PRODUTO
2060,PAO LEVAIN MINEIROCA UN - 200g,,PRODUTO
2581,PAO LEVAIN MINI BAGUETE C/2UN CONG - 200g,,PRODUTO
2080,PAO LEVAIN NOZES C/MEL KG - 1,,PRODUTO
3978,PÃO LEVAIN BRAGA UN - 200g,,PRODUTO
3969,PÃO LEVAIN CAMPANHA UN - 200g,,PRODUTO
2524,PÃO LEVAIN NOZES C/ MEL UN  - 200g,,PRODUTO
2691,ASSADO DE SALSICHA ALVORADA UN - 100g,,PRODUTO
4562,CIGARRETE UN CD - 130g,,PRODUTO
866,COXINHA DE FRANGO ALVORADA UN - 100g,,PRODUTO
2542,COXINHA DE FRANGO C/REQUEIJAO GRANDE UN  - 100g,,PRODUTO
1902,COXINHA DE FRANGO GRANDE UN - 100g,,PRODUTO
8607,DADINHO DE TAPIOCA KG - 1,,PRODUTO
2515,DOGUINHO C.D. ALVORADA KG - 1,,PRODUTO
2394,EMPADA DE CARNE SECA UN - 100g,,PRODUTO
1886,EMPADA DE FRANGO UN - 100g,,PRODUTO
2393,EMPADA DE PALMITO UN  - 100g,,PRODUTO
4819,ESFIHA ABERTA 4 QUEIJOS UN - 200g,,PRODUTO
4818,ESFIHA ABERTA DE CARNE UN - 200g,,PRODUTO
2629,ESFIHA ABERTA DE FRANGO C/REQUEIJAO UN - 200g,,PRODUTO
2599,ESFIHA FECHADA DE CARNE UN - 100g,,PRODUTO
2624,ESFIHA FECHADA DE FRANGO C/REQUEIJAO UN - 100g,,PRODUTO
8443,FAROFA ALVORADA KG - 1,,PRODUTO
5352,MINI EMPADA DE FRANGO ALVORADA C/6 UN - 280g,,PRODUTO
2198,MINI EMPADINHA ALVORADA KG - 1,,PRODUTO
5369,MISTO PRESUNTO E QUEIJO UN - 200g,,PRODUTO
2674,PASTEL ASSADO DE CARNE ALVORADA UN - 1un,,PRODUTO
2678,PASTEL ASSADO DE FRANGO UN - 1un,,PRODUTO
267250,PASTEL DE FARINHA DE MILHO CARNE 100g - 100g,,PRODUTO
267251,PASTEL DE FARINHA DE MILHO QUEIJO 100g - 100g,,PRODUTO
8406,PASTEL DE MILHO CARNE KG - 1,,PRODUTO
8408,PASTEL DE MILHO PIZZA KG - 1,,PRODUTO
8407,PASTEL DE MILHO QUEIJO KG - 1,,PRODUTO
6049,PATE DE FRANGO C/ ABACAXI UN - 400g,,PRODUTO
2534,PATE DE FRANGO C/ CENOURA UN - 400g,,PRODUTO
2154,PATE DE QUATRO QUEIJOS UN - 400g,,PRODUTO
2197,PURURUCA UN - 100g,,PRODUTO
2496,QUIBE DE CARNE GRANDE UN - 100g,,PRODUTO
5291,TORTA DE FRANGO C/CATUPIRY KG - 1,,PRODUTO
8439,VINAGRETE ALVORADA KG - 1,,PRODUTO
266399,ALÇA 5L - 1un,,MATERIA PRIMA
267977,APARADOR RETO 128X50 PETG 3MM - 1un,,MATERIA PRIMA
171482,BAND. PLAST. P/COLOMBA G34 (LINHA 247) - 100un,,MATERIA PRIMA
228388,BANDEJA M-03  (LINHA 247) - 1un,,MATERIA PRIMA
224862,CAIXA PANETTONE (LINHA 247) - 1un,,MATERIA PRIMA
224861,CAIXA PANETTONE C/GOTAS (LINHA 247) - 1un,,MATERIA PRIMA
226429,DISCO DE ISOPOR P/PIZZA 30CM (LINHA 247) - 1un,,MATERIA PRIMA
231456,DISCO ISOPOR 18CM (LINHA 247) - 1un,,MATERIA PRIMA
227255,DISCO P/PIZZA 15CM (LINHA 247) - 1un,,MATERIA PRIMA
259173,EMB DELPACK R50 PRETA (LINHA 247) - UN,,MATERIA PRIMA
237143,EMB DELPACK R85 (LINHA 247) - 1un,,MATERIA PRIMA
257485,EMB DELPAK D100 PRETA (LINHA 247) - 1un,,MATERIA PRIMA
257837,EMB DELPAK D76 (LINHA 247) - 1un,,MATERIA PRIMA
257484,EMB DELPAK D77 PRETA (LINHA 247) - 1un,,MATERIA PRIMA
225647,EMB DELPAK K170 (LINHA 247) - UN,,MATERIA PRIMA
263630,EMB G-10 DONUTS (LINHA 247) - 1,,MATERIA PRIMA
257023,"EMB GELO 25X35 1,5KG ( LINHA 247) - UN",,MATERIA PRIMA
226787,EMB PIZZA S/TAMPA DESPESA (LINHA 247) - 1un,,MATERIA PRIMA
236443,"EMB VERDE 23,5X50 (LINHA 247) - 1un",,MATERIA PRIMA
226213,EMB.  28X46 GELO 3KG (LINHA 247) - 1,,MATERIA PRIMA
73733,EMB. G-732 PADARIA (LINHA 247) - UN,,MATERIA PRIMA
223564,EMB. M-58 (LINHA 247) - 1un,,MATERIA PRIMA
262987,EMB. MEI 105 - 500ML (LINHA 247) - 1un,,MATERIA PRIMA
174506,EMB. MEI 105 250ML (LINHA 247) - 1UN,,MATERIA PRIMA
225644,EMB. MEI-105 - 700ML (LINHA 247) - 1un,,MATERIA PRIMA
228106,EMB. MEI-160 900ML (LINHA 247) - 1,,MATERIA PRIMA
66250,EMB. MP-15 ALTA (LINHA 247) - UN,,MATERIA PRIMA
227303,EMB. MP-3R BOLO GOURMET (LINHA 247) - UN,,MATERIA PRIMA
226275,EMB. PALITO TRES QUEIJOS (LINHA 247) - 400g,,MATERIA PRIMA
226274,EMB. PAO DE QUEIJO COQUETEL (LINHA 247) - 400g,,MATERIA PRIMA
226273,EMB. PAO DE QUEIJO LANCHE (LINHA 247) - 1kg,,MATERIA PRIMA
226272,EMB. PAO DE QUEIJO TRAD (LINHA 247) - 1kg,,MATERIA PRIMA
226270,EMB. PAO DE QUEIJO TRAD (LINHA 247) - 400g,,MATERIA PRIMA
227332,EMB. PAPEL ALUMINIO (LINHA 247) - 1un,,MATERIA PRIMA
227301,EMB. POTE P13 (LINHA 247) - 1un,,MATERIA PRIMA
226747,EMB. PUDIM GRANDE (LINHA 247) - 1un,,MATERIA PRIMA
227553,EMB. PUDIM MEDIO (LINHA 247) - 250un,,MATERIA PRIMA
226746,EMB. PUDIM PEQUENA (LINHA 247) - 1un,,MATERIA PRIMA
237819,EMBAL DELPACK D90 (LINHA 247) - 1un,,MATERIA PRIMA
237817,EMBAL DELPACK PRATO 08 BRANC TP F CX-200 - 1un,,MATERIA PRIMA
236168,EMBAL DELPACK PRATO 09 BRANCA TP FILME - 1un,,MATERIA PRIMA
237818,EMBAL DELPACK PRATO 10 BRANC TP F CX-200 - 1un,,MATERIA PRIMA
88338,EMBALAGEM - 1un,,MATERIA PRIMA
236450,EMBALAGEM G-650 (LINHA 247) - 1un,,MATERIA PRIMA
236749,EMBALAGEM G-680 MOUSSE (LINHA 247) - 1un,,MATERIA PRIMA
236893,EMBALAGEM P64 (LINHA 247) - 1un,,MATERIA PRIMA
261870,ETIQUETA BOPP 60X110 (LINHA 247) - 1un,,MATERIA PRIMA
